{
  "$schema": "https://json-schema.org/draft/2020-12/schema",
  "title": "Agent Arena workflow",
  "type": "object",
  "additionalProperties": false,
  "required": ["schemaVersion", "id", "name", "headAgent", "agents", "relationships", "settings"],
  "properties": {
    "schemaVersion": { "const": 1 },
    "id": { "$ref": "#/$defs/id" },
    "name": { "type": "string", "minLength": 1 },
    "description": { "type": "string" },
    "headAgent": { "$ref": "#/$defs/id" },
    "agents": {
      "type": "array",
      "minItems": 1,
      "items": { "$ref": "#/$defs/agentNode" }
    },
    "teams": {
      "type": "array",
      "items": { "$ref": "#/$defs/team" }
    },
    "decisionRouters": {
      "type": "array",
      "items": { "$ref": "#/$defs/decisionRouter" }
    },
    "onCall": {
      "type": "array",
      "items": { "$ref": "#/$defs/onCallRule" }
    },
    "relationships": {
      "type": "array",
      "items": { "$ref": "#/$defs/relationship" }
    },
    "settings": { "$ref": "#/$defs/settings" }
  },
  "$defs": {
    "id": {
      "type": "string",
      "pattern": "^[a-z0-9][a-z0-9._-]*$",
      "maxLength": 64
    },
    "agentNode": {
      "type": "object",
      "additionalProperties": false,
      "required": ["id", "profile", "runtime"],
      "properties": {
        "id": { "$ref": "#/$defs/id" },
        "profile": {
          "type": "string",
          "pattern": "^\\.agents/[a-z0-9][a-z0-9._-]*/[a-z0-9][a-z0-9._-]*\\.agent\\.json$"
        },
        "activation": { "enum": ["path", "on-call"] },
        "level": { "type": "integer", "minimum": 0 },
        "runtime": { "$ref": "#/$defs/runtime" }
      },
      "allOf": [
        {
          "if": { "properties": { "activation": { "const": "on-call" } }, "required": ["activation"] },
          "then": { "not": { "required": ["level"] } },
          "else": { "required": ["level"] }
        }
      ]
    },
    "runtime": {
      "type": "object",
      "additionalProperties": false,
      "required": ["provider", "model"],
      "properties": {
        "provider": { "type": "string", "minLength": 1 },
        "model": { "type": "string", "minLength": 1 },
        "reasoningEffort": { "type": "string", "minLength": 1 },
        "options": {
          "type": "object",
          "description": "Provider-specific options. The selected adapter owns their meaning.",
          "additionalProperties": true
        }
      },
      "allOf": [
        {
          "if": { "properties": { "provider": { "const": "local" } }, "required": ["provider"] },
          "then": {
            "required": ["options"],
            "properties": {
              "options": {
                "type": "object",
                "required": ["backend"],
                "properties": {
                  "backend": { "enum": ["ollama", "lm-studio", "llama.cpp", "vllm", "openai-compatible"] },
                  "endpoint": { "type": "string", "format": "uri" }
                }
              }
            }
          }
        },
        {
          "if": { "properties": { "provider": { "const": "gemini" } }, "required": ["provider"] },
          "then": {
            "required": ["options"],
            "properties": {
              "options": {
                "type": "object",
                "required": ["authMethod"],
                "properties": {
                  "authMethod": { "enum": ["google-ai-studio-api-key", "vertex-ai"] }
                }
              }
            }
          }
        }
      ]
    },
    "decisionRouter": {
      "type": "object",
      "additionalProperties": false,
      "required": ["id", "name", "inputKind", "payloadPointer", "routes", "fallback"],
      "properties": {
        "id": { "$ref": "#/$defs/id" },
        "name": { "type": "string", "minLength": 1 },
        "inputKind": { "enum": ["review-result", "team-result", "result", "error", "context-result"] },
        "payloadPointer": { "type": "string", "pattern": "^/" },
        "routes": {
          "type": "array",
          "minItems": 1,
          "items": { "$ref": "#/$defs/decisionRoute" }
        },
        "fallback": {
          "oneOf": [
            {
              "type": "object",
              "additionalProperties": false,
              "required": ["action"],
              "properties": { "action": { "const": "ask-user" } }
            },
            {
              "type": "object",
              "additionalProperties": false,
              "required": ["action"],
              "properties": { "action": { "const": "stop" } }
            },
            {
              "type": "object",
              "additionalProperties": false,
              "required": ["action", "to"],
              "properties": {
                "action": { "const": "route" },
                "to": { "$ref": "#/$defs/id" }
              }
            }
          ]
        }
      }
    },
    "decisionRoute": {
      "type": "object",
      "additionalProperties": false,
      "required": ["id", "equals", "to"],
      "properties": {
        "id": { "$ref": "#/$defs/id" },
        "equals": { "type": ["string", "number", "boolean", "null"] },
        "to": { "$ref": "#/$defs/id" }
      }
    },
    "relationship": {
      "oneOf": [
        {
          "type": "object",
          "additionalProperties": false,
          "required": ["type", "from", "to"],
          "properties": {
            "type": { "const": "delegates" },
            "from": { "$ref": "#/$defs/id" },
            "to": { "$ref": "#/$defs/id" }
          }
        },
        {
          "type": "object",
          "additionalProperties": false,
          "required": ["type", "from", "to", "direction"],
          "properties": {
            "type": { "const": "communicates" },
            "from": { "$ref": "#/$defs/id" },
            "to": { "$ref": "#/$defs/id" },
            "direction": { "enum": ["one-way", "two-way"] }
          }
        }
      ]
    },
    "team": {
      "type": "object",
      "additionalProperties": false,
      "required": ["id", "name", "members", "facilitator", "consensus", "outputContract"],
      "properties": {
        "id": { "$ref": "#/$defs/id" },
        "name": { "type": "string", "minLength": 1 },
        "members": {
          "type": "array",
          "minItems": 2,
          "uniqueItems": true,
          "items": { "$ref": "#/$defs/id" }
        },
        "facilitator": { "$ref": "#/$defs/id" },
        "consensus": {
          "type": "object",
          "additionalProperties": false,
          "required": ["mode", "maxRounds"],
          "properties": {
            "mode": { "const": "unanimous-deliberation" },
            "maxRounds": { "type": "integer", "minimum": 1, "maximum": 5 }
          }
        },
        "outputContract": {
          "type": "object",
          "additionalProperties": false,
          "required": ["format", "verdicts"],
          "properties": {
            "format": { "const": "arena.team-verdict.v1" },
            "verdicts": {
              "type": "array",
              "minItems": 1,
              "uniqueItems": true,
              "items": { "type": "string", "minLength": 1 }
            }
          }
        }
      }
    },
    "onCallRule": {
      "type": "object",
      "additionalProperties": false,
      "required": ["agentId", "maxInvocationsPerRun", "triggers"],
      "properties": {
        "agentId": { "$ref": "#/$defs/id" },
        "maxInvocationsPerRun": { "type": "integer", "minimum": 1 },
        "triggers": {
          "type": "array",
          "minItems": 1,
          "items": { "$ref": "#/$defs/onCallTrigger" }
        }
      }
    },
    "onCallTrigger": {
      "oneOf": [
        {
          "type": "object",
          "additionalProperties": false,
          "required": ["type"],
          "properties": { "type": { "const": "manual" } }
        },
        {
          "type": "object",
          "additionalProperties": false,
          "required": ["type", "event"],
          "properties": {
            "type": { "const": "event" },
            "event": { "enum": ["team.no-consensus", "agent.failed", "validation.failed", "change.touches-paths"] },
            "teamId": { "$ref": "#/$defs/id" },
            "agentId": { "$ref": "#/$defs/id" },
            "paths": {
              "type": "array",
              "minItems": 1,
              "items": { "type": "string", "minLength": 1 }
            }
          },
          "allOf": [
            {
              "if": { "properties": { "event": { "const": "team.no-consensus" } }, "required": ["event"] },
              "then": {
                "required": ["teamId"],
                "not": { "anyOf": [{ "required": ["agentId"] }, { "required": ["paths"] }] }
              }
            },
            {
              "if": { "properties": { "event": { "const": "agent.failed" } }, "required": ["event"] },
              "then": {
                "required": ["agentId"],
                "not": { "anyOf": [{ "required": ["teamId"] }, { "required": ["paths"] }] }
              }
            },
            {
              "if": { "properties": { "event": { "const": "validation.failed" } }, "required": ["event"] },
              "then": { "not": { "anyOf": [{ "required": ["teamId"] }, { "required": ["agentId"] }, { "required": ["paths"] }] } }
            },
            {
              "if": { "properties": { "event": { "const": "change.touches-paths" } }, "required": ["event"] },
              "then": {
                "required": ["paths"],
                "not": { "anyOf": [{ "required": ["teamId"] }, { "required": ["agentId"] }] }
              }
            }
          ]
        }
      ]
    },
    "settings": {
      "type": "object",
      "additionalProperties": false,
      "required": ["maxConcurrentAgents", "workspace", "integration", "audit"],
      "properties": {
        "backgroundShader": {
          "type": "object",
          "additionalProperties": false,
          "required": ["enabled", "source", "glyphs"],
          "properties": {
            "enabled": { "type": "boolean" },
            "source": { "type": "string", "pattern": "^[a-z0-9][a-z0-9._-]*\\.background\\.hlsl$", "maxLength": 96 },
            "glyphs": { "type": "string", "pattern": "^[ .,:;~+=*#%@-]{1,16}$" }
          }
        },
        "maxConcurrentAgents": { "type": "integer", "minimum": 1 },
        "workspace": {
          "type": "object",
          "additionalProperties": false,
          "required": ["writeIsolation"],
          "properties": {
            "writeIsolation": { "enum": ["git-worktree-per-task"] }
          }
        },
        "integration": {
          "type": "object",
          "additionalProperties": false,
          "required": ["policy"],
          "properties": {
            "policy": { "enum": ["human-review", "auto-if-clean"] }
          }
        },
        "audit": {
          "type": "object",
          "additionalProperties": false,
          "required": ["retention"],
          "properties": {
            "retention": { "enum": ["full-local", "redacted-local"] }
          }
        },
        "sharedContext": {
          "type": "object",
          "description": "Optional workflow-level restrictions; values may tighten project settings but never loosen them.",
          "additionalProperties": false,
          "properties": {
            "agentWritePolicy": { "enum": ["auto-refuse", "ask-user", "auto-accept"] },
            "agentDeletePolicy": { "enum": ["auto-refuse", "ask-user", "auto-accept"] },
            "maxEntries": { "type": "integer", "minimum": 1 },
            "maxEntryBytes": { "type": "integer", "minimum": 256 },
            "maxTotalBytes": { "type": "integer", "minimum": 1024 },
            "staleAfterDays": { "type": "integer", "minimum": 0 }
          }
        }
      }
    }
  }
}
